{
  "id": 338176,
  "name": "Sample Workato Recipe",
  "description": "Automated workflow for connecting enterprise applications.",
  "folder_id": 82,
  "state": "stopped",
  "instructions": "sample-instructions",
  "ai_provider": "sample-ai_provider",
  "created_at": "2026-01-15T10:00:00Z",
  "updated_at": "2026-04-20T14:30:00Z"
}